{
  "meta": {
    "title": "Frontier Question template · doc",
    "description": "Doc reader for docs/frontier-question-template.html from the Great Library: breadcrumb, title and source meta, contents from its headings, the body verbatim under the shell, evidence panel with path, lines, bytes, sha256 and commits.",
    "stream": "research",
    "crumb": [
      {
        "label": "Templates",
        "href": "/"
      },
      {
        "label": "U7 · Doc reader",
        "href": "/t/U7/"
      },
      {
        "label": "frontier-question-template"
      }
    ],
    "actions": [
      {
        "label": "Source on GitHub",
        "href": "https://github.com/sisodias/great-library-of-siso/blob/781ea9c/docs/frontier-question-template.html",
        "icon": "file-code",
        "external": true
      },
      {
        "label": "As published today",
        "href": "https://great-library-of-siso.pages.dev/docs/frontier-question-template",
        "icon": "arrow-up-right",
        "external": true
      }
    ],
    "source": "Great_Library_of_SISO/docs/frontier-question-template.html at 781ea9c (repo head 477b775) · wc, shasum, git log 6 Sep 20:08 UTC+07 · registry/events/2026-08-01-mission-question-architecture-completed.json · docs/README.md:19 · site/intelligence.json"
  },
  "heading": {
    "breadcrumb": [
      {
        "label": "Library",
        "href": "https://great-library-of-siso.pages.dev"
      },
      {
        "label": "docs",
        "href": "https://great-library-of-siso.pages.dev/docs/"
      },
      {
        "label": "frontier-question-template"
      }
    ],
    "kicker": "doc <span class=\"sep\">·</span> rendered from docs/frontier-question-template.html <span class=\"sep\">·</span> <span class=\"dim\">Frontier Questions · Reusable dossier</span>",
    "title": "One question. One living evidence spine.",
    "subtitle": "A reusable Frontier Question dossier template with assumptions, source queues, claims, ADRs, experiments, answer Releases, and a worked CRM architecture example.",
    "badges": [
      {
        "label": "doc · research",
        "tone": "research",
        "dot": true
      },
      {
        "label": "3 chapters · 6 subheadings",
        "tone": "research",
        "href": "#copyable-question-dossier"
      },
      {
        "label": "v 781ea9c · 2 Aug 2026",
        "tone": "projects",
        "href": "#evidence"
      },
      {
        "label": "sha256 4612cbf1…687f31",
        "tone": "muted",
        "href": "#evidence"
      },
      {
        "label": "no shell on the live copy",
        "tone": "warn",
        "href": "#evidence"
      }
    ],
    "status": {
      "kicker": "Source and version",
      "value": "781ea9c · 2 Aug 2026 02:03",
      "note": "Three commits touch this file (1–2 Aug 2026), all by Lordsisodia; the last is \"registry: dogfood GQ-009 learning return\". Author seat: the Great Library research maintainer on branch codex/mission-question-architecture-20260801 (registry event, 1 Aug 23:01).",
      "facts": [
        {
          "k": "path",
          "v": "<code>docs/frontier-question-template.html</code>"
        },
        {
          "k": "size",
          "v": "216 lines · 13,801 bytes"
        },
        {
          "k": "sha256",
          "v": "<code>4612cbf1938e54a846553f6d676e85d7af5734b79063724a73a83eff74687f31</code>"
        },
        {
          "k": "author seat",
          "v": "Great Library research maintainer · Codex branch"
        },
        {
          "k": "live",
          "v": "<a href=\"https://great-library-of-siso.pages.dev/docs/frontier-question-template\">/docs/frontier-question-template</a> · 200 (308 from .html) · no rail"
        }
      ]
    },
    "metrics": [
      {
        "value": 3,
        "label": "chapters in the document",
        "tone": "research",
        "href": "#abstract"
      },
      {
        "value": 5,
        "label": "facts with receipts",
        "tone": "now",
        "href": "#evidence"
      },
      {
        "value": 6,
        "label": "related records",
        "tone": "muted",
        "href": "#related"
      }
    ],
    "jump": [
      {
        "label": "Abstract",
        "href": "#abstract"
      },
      {
        "label": "Evidence · version",
        "href": "#evidence"
      },
      {
        "label": "Related",
        "href": "#related"
      },
      {
        "label": "Agent entry",
        "href": "#agent"
      }
    ]
  },
  "sections": {
    "abstract": {
      "n": "00",
      "title": "Abstract",
      "sub": "the document's own opening, verbatim"
    },
    "evidence": {
      "n": "04",
      "title": "Evidence · version",
      "sub": "what this page renders, from which bytes; the claim ceiling"
    },
    "related": {
      "n": "05",
      "title": "Related"
    },
    "agent": {
      "n": "06",
      "title": "Agent entry"
    }
  },
  "abstract": {
    "lede": "Create one dossier per Frontier Question. The dossier is the operating map; the stable question remains a Library Work, and each accepted answer remains an immutable Release. Large, private, licensed, or operational payloads stay with their owning evidence systems. The registry scaffold below is the public-safe read model, not a second dossier or evidence store.",
    "callout": "<strong>Template rule:</strong> do not fill every field with ceremonial prose. A field exists to change retrieval, reasoning, a decision, or a refresh trigger. Mark unknowns honestly. Link evidence rather than copying entire corpora.",
    "facts": [
      {
        "k": "what it is",
        "v": "a template: the fields a Frontier Question dossier carries and a worked composable-CRM example (docs/README.md:19)"
      },
      {
        "k": "sits in",
        "v": "<a href=\"https://great-library-of-siso.pages.dev/docs/\">Library docs</a> · mission thread <code>gls:thread:mission-question-architecture</code> (registry event 2026-08-01)"
      },
      {
        "k": "used by",
        "v": "the 17 <code>frontier-question-gq-*</code> Works in registry/works; the last commit dogfooded it on <a href=\"https://great-library-of-siso.pages.dev/works/frontier-question-gq-009/\">GQ-009</a>"
      },
      {
        "k": "may claim",
        "v": "a structure, not an answer: no Frontier Question is answered by this document"
      }
    ]
  },
  "contents": {
    "from": "from its h2 · h3"
  },
  "chapters": [
    {
      "id": "copyable-question-dossier",
      "n": "01",
      "title": "Copyable question dossier",
      "subs": [],
      "html": "<pre class=\"template\">FRONTIER QUESTION\nID / public label:\nTitle:\nExact question:\nWhy this matters / value path:\nDecision owner and steward:\nStatus: proposed | scoped | active | synthesis | released | watching | challenged\nTime horizon:\nPublic / private boundary:\nExpected answer shape:\nRefresh triggers:\n\nFRAME\nDefinitions:\nIn scope:\nOut of scope:\nConstraints:\nSubquestions:\nSuccess / decision threshold:\nKnown disagreements:\n\nBASELINE\nCurrent best answer:\nConfidence and why:\nCandidate answers / hypotheses:\nWhat would reverse the leading view:\nKnown unknowns:\n\nASSUMPTION LEDGER\n- ID: GA-___ | DA-___ | QA-___ | AA-___\n  Statement:\n  Scope and status:\n  Confidence:\n  Evidence for / against:\n  Falsifier:\n  Depends on / dependents:\n  Last reviewed / supersedes:\n\nEVIDENCE UNIVERSE\nFoundry scopes and watchlists:\nRepositories / code:\nPeople / organizations:\nBooks:\nPapers / official documentation:\nWeb / community / videos:\nDatasets:\nSISO systems / experiments / user evidence:\nMissing viewpoints and rights constraints:\n\nSOURCE QUEUE\n- Source ID / locator / edition or revision:\n  Source type and creator:\n  Rights / publication boundary:\n  Relevance hypothesis:\n  Assumption or subquestion targeted:\n  Expected information gain:\n  Read state and extraction receipt:\n\nCLAIM + CONTRADICTION LEDGER\n- Claim ID / atomic statement / type / scope:\n  Supporting sources:\n  Refuting sources:\n  Witness independence:\n  Applicability and confidence:\n  Unresolved contradiction:\n\nFIRST-PRINCIPLES SYNTHESIS\nIrreducible constraints:\nMechanisms and causal model:\nIncentives / information flows / feedback loops:\nUniversal findings vs SISO preferences:\nKilled hypotheses and why:\nWhat the evidence cannot establish:\n\nIMPLICATIONS\nAssumptions changed:\nCapability or stack map changed:\nADRs create / revisit / supersede:\nExperiments to run:\nNo-regret actions:\nActions explicitly not justified:\n\nANSWER RELEASE\nAnswer and grade:\nEvidence universe and cutoff:\nLoad-bearing assumptions:\nLimitations and contradictions:\nPredictions:\nDecision / implementation implications:\nSuccessor and superseded answer IDs:\nNext watch date / event triggers:</pre>"
    },
    {
      "id": "minimal-registry-scaffold",
      "n": "02",
      "title": "Minimal registry scaffold",
      "subs": [],